{
  "schema_version": "1.0",
  "dataset_id": "libuv-post-freeze-callgraph-v1",
  "identity_profile": "default",
  "annotation_scope": {
    "mode": "closed_world",
    "categories": [
      "call_chain"
    ],
    "paths": [
      "src/unix/dl.c"
    ]
  },
  "review": {
    "method": "post_freeze_source_review_by_codex",
    "human_review": "pending",
    "limitation": "Single-file holdout authored after the synthetic suite was frozen."
  },
  "repository": "libuv/libuv",
  "commit": "8fb9cb919489a48880680a56efecff6a7dfb4504",
  "cases": [
    {
      "id": "libuv_dlopen_dlerror",
      "category": "call_chain",
      "identity": [
        "fn:uv_dlopen",
        "fn:dlerror"
      ],
      "kind": "direct_call",
      "expected_exists": true,
      "evidence": [
        {
          "file": "src/unix/dl.c",
          "line": 34,
          "snippet": "dlerror(); /* Reset error status. */"
        }
      ]
    },
    {
      "id": "libuv_dlopen_dlopen",
      "category": "call_chain",
      "identity": [
        "fn:uv_dlopen",
        "fn:dlopen"
      ],
      "kind": "direct_call",
      "expected_exists": true,
      "evidence": [
        {
          "file": "src/unix/dl.c",
          "line": 36,
          "snippet": "lib->handle = dlopen(filename, RTLD_LAZY);"
        }
      ]
    },
    {
      "id": "libuv_dlopen_error_helper",
      "category": "call_chain",
      "identity": [
        "fn:uv_dlopen",
        "fn:uv__dlerror"
      ],
      "kind": "direct_call",
      "expected_exists": true,
      "evidence": [
        {
          "file": "src/unix/dl.c",
          "line": 37,
          "snippet": "return lib->handle ? 0 : uv__dlerror(lib);"
        }
      ]
    },
    {
      "id": "libuv_dlclose_free",
      "category": "call_chain",
      "identity": [
        "fn:uv_dlclose",
        "fn:uv__free"
      ],
      "kind": "direct_call",
      "expected_exists": true,
      "evidence": [
        {
          "file": "src/unix/dl.c",
          "line": 42,
          "snippet": "uv__free(lib->errmsg);"
        }
      ]
    },
    {
      "id": "libuv_dlclose_dlclose",
      "category": "call_chain",
      "identity": [
        "fn:uv_dlclose",
        "fn:dlclose"
      ],
      "kind": "direct_call",
      "expected_exists": true,
      "evidence": [
        {
          "file": "src/unix/dl.c",
          "line": 47,
          "snippet": "dlclose(lib->handle);"
        }
      ]
    },
    {
      "id": "libuv_dlsym_dlerror",
      "category": "call_chain",
      "identity": [
        "fn:uv_dlsym",
        "fn:dlerror"
      ],
      "kind": "direct_call",
      "expected_exists": true,
      "evidence": [
        {
          "file": "src/unix/dl.c",
          "line": 54,
          "snippet": "dlerror(); /* Reset error status. */"
        }
      ]
    },
    {
      "id": "libuv_dlsym_dlsym",
      "category": "call_chain",
      "identity": [
        "fn:uv_dlsym",
        "fn:dlsym"
      ],
      "kind": "direct_call",
      "expected_exists": true,
      "evidence": [
        {
          "file": "src/unix/dl.c",
          "line": 55,
          "snippet": "*ptr = dlsym(lib->handle, name);"
        }
      ]
    },
    {
      "id": "libuv_dlsym_error_helper",
      "category": "call_chain",
      "identity": [
        "fn:uv_dlsym",
        "fn:uv__dlerror"
      ],
      "kind": "direct_call",
      "expected_exists": true,
      "evidence": [
        {
          "file": "src/unix/dl.c",
          "line": 56,
          "snippet": "return *ptr ? 0 : uv__dlerror(lib);"
        }
      ]
    },
    {
      "id": "libuv_dlerror_helper_free",
      "category": "call_chain",
      "identity": [
        "fn:uv__dlerror",
        "fn:uv__free"
      ],
      "kind": "direct_call",
      "expected_exists": true,
      "evidence": [
        {
          "file": "src/unix/dl.c",
          "line": 68,
          "snippet": "uv__free(lib->errmsg);"
        }
      ]
    },
    {
      "id": "libuv_dlerror_helper_dlerror",
      "category": "call_chain",
      "identity": [
        "fn:uv__dlerror",
        "fn:dlerror"
      ],
      "kind": "direct_call",
      "expected_exists": true,
      "evidence": [
        {
          "file": "src/unix/dl.c",
          "line": 70,
          "snippet": "errmsg = dlerror();"
        }
      ]
    },
    {
      "id": "libuv_dlerror_helper_strdup",
      "category": "call_chain",
      "identity": [
        "fn:uv__dlerror",
        "fn:uv__strdup"
      ],
      "kind": "direct_call",
      "expected_exists": true,
      "evidence": [
        {
          "file": "src/unix/dl.c",
          "line": 73,
          "snippet": "lib->errmsg = uv__strdup(errmsg);"
        }
      ]
    }
  ]
}
