{
  "schema_version": "1.0",
  "dataset_id": "libuv-post-freeze-sync-v1",
  "identity_profile": "default",
  "annotation_scope": {
    "mode": "closed_world",
    "categories": [
      "sync_relation"
    ],
    "paths": [
      "src/unix/thread.c"
    ],
    "functions": [
      "uv_cond_destroy"
    ]
  },
  "review": {
    "method": "post_freeze_source_review_by_codex",
    "human_review": "pending",
    "limitation": "Single-function holdout authored after the synthetic suite was frozen."
  },
  "repository": "libuv/libuv",
  "commit": "8fb9cb919489a48880680a56efecff6a7dfb4504",
  "cases": [
    {
      "id": "libuv_sync_lock_timedwait",
      "category": "sync_relation",
      "identity": [
        "uv_cond_destroy",
        "uv_cond_destroy",
        "src/unix/thread.c",
        782,
        "src/unix/thread.c",
        788
      ],
      "kind": "happens_before",
      "expected_exists": true,
      "evidence": [
        {
          "file": "src/unix/thread.c",
          "line": 782,
          "snippet": "if (pthread_mutex_lock(&mutex))"
        },
        {
          "file": "src/unix/thread.c",
          "line": 788,
          "snippet": "err = pthread_cond_timedwait_relative_np(cond, &mutex, &ts);"
        }
      ]
    },
    {
      "id": "libuv_sync_timedwait_unlock",
      "category": "sync_relation",
      "identity": [
        "uv_cond_destroy",
        "uv_cond_destroy",
        "src/unix/thread.c",
        788,
        "src/unix/thread.c",
        792
      ],
      "kind": "happens_before",
      "expected_exists": true,
      "evidence": [
        {
          "file": "src/unix/thread.c",
          "line": 788,
          "snippet": "err = pthread_cond_timedwait_relative_np(cond, &mutex, &ts);"
        },
        {
          "file": "src/unix/thread.c",
          "line": 792,
          "snippet": "if (pthread_mutex_unlock(&mutex))"
        }
      ]
    },
    {
      "id": "libuv_sync_lock_unlock",
      "category": "sync_relation",
      "identity": [
        "uv_cond_destroy",
        "uv_cond_destroy",
        "src/unix/thread.c",
        782,
        "src/unix/thread.c",
        792
      ],
      "kind": "happens_before",
      "expected_exists": true,
      "evidence": [
        {
          "file": "src/unix/thread.c",
          "line": 782,
          "snippet": "if (pthread_mutex_lock(&mutex))"
        },
        {
          "file": "src/unix/thread.c",
          "line": 792,
          "snippet": "if (pthread_mutex_unlock(&mutex))"
        }
      ]
    }
  ]
}
